{
  "assurance_decisions": 0,
  "checkpoint_count": 3,
  "complete": true,
  "digest": "17fe6ae9fc88201cf18dc2ea8e8b7ee87c2f52aa815f628112ca50c9a97163dd",
  "engineering_readiness": "not_evaluated",
  "event_contract_version": 4,
  "event_position": 63,
  "gate_handoff": null,
  "intent_id": "score-someip84-factory-zd4mjmhk",
  "kind": "runtime_snapshot",
  "last_checkpoint": {
    "attempt": 1,
    "checkpoint_seq": 11,
    "diff_summary": {
      "additions": 0,
      "deletions": 0,
      "files_changed": 0
    },
    "execution": 0,
    "firing": 3,
    "node_name": "node_c4050edbd9e656239231b437",
    "ordinal": 3,
    "run_commit_sha": "67783abebc51f351341a0e4b323a188f7782a6e7",
    "stage": "node_c4050edbd9e656239231b437@1",
    "visit": 1,
    "workspace": "invocation-0-scope-0"
  },
  "native_blocked_reason": "human_input_required",
  "native_reason": null,
  "native_status": "blocked",
  "next_action": "none",
  "pending_control": null,
  "questions": [
    {
      "allow_freeform": false,
      "id": "node_ff6d8db1495ac2c7e7411ed4#4",
      "options": [
        {
          "key": "e",
          "label": "exit"
        }
      ],
      "question_type": "yes_no",
      "stage": "node_ff6d8db1495ac2c7e7411ed4@1",
      "text": "Agent admission pending: provider and spending limit",
      "timeout_seconds": 420.0
    }
  ],
  "reason_codes": [
    "QUESTION_SUBJECT_UNKNOWN"
  ],
  "run_id": "01M3VZNAAQ1QXK5530X7E8HZ26",
  "schema_version": 1,
  "stages": [
    {
      "graph_visit": 1,
      "handler": "start",
      "id": "start@1",
      "name": "start",
      "node_id": "start",
      "started_at": "2026-10-01T14:59:55.004Z",
      "status": "succeeded",
      "usage": {
        "tokens": {
          "cache_read": 0,
          "cache_write": 0,
          "input": 0,
          "output": 0,
          "reasoning": 0
        }
      },
      "visit": 1,
      "wall_time_ms": 2
    },
    {
      "graph_visit": 1,
      "handler": "command",
      "id": "node_f9fb889a6260f0b424c036ce@1",
      "name": "node_f9fb889a6260f0b424c036ce",
      "node_id": "node_f9fb889a6260f0b424c036ce",
      "started_at": "2026-10-01T14:59:55.092Z",
      "status": "succeeded",
      "usage": {
        "tokens": {
          "cache_read": 0,
          "cache_write": 0,
          "input": 0,
          "output": 0,
          "reasoning": 0
        }
      },
      "visit": 1,
      "wall_time_ms": 5443
    },
    {
      "graph_visit": 1,
      "handler": "command",
      "id": "node_c4050edbd9e656239231b437@1",
      "name": "node_c4050edbd9e656239231b437",
      "node_id": "node_c4050edbd9e656239231b437",
      "started_at": "2026-10-01T15:00:00.580Z",
      "status": "succeeded",
      "usage": {
        "tokens": {
          "cache_read": 0,
          "cache_write": 0,
          "input": 0,
          "output": 0,
          "reasoning": 0
        }
      },
      "visit": 1,
      "wall_time_ms": 5501
    },
    {
      "graph_visit": 1,
      "handler": "human",
      "id": "node_ff6d8db1495ac2c7e7411ed4@1",
      "name": "node_ff6d8db1495ac2c7e7411ed4",
      "node_id": "node_ff6d8db1495ac2c7e7411ed4",
      "started_at": "2026-10-01T15:00:06.124Z",
      "status": "running",
      "usage": {
        "tokens": {
          "cache_read": 0,
          "cache_write": 0,
          "input": 0,
          "output": 0,
          "reasoning": 0
        }
      },
      "visit": 1,
      "wall_time_ms": 109332
    }
  ],
  "version_id": "8b029e1cdf2aa83328db20c6fea8afd9050218aec985a4e01c369c675c517272"
}
